area,recommendation
Budget Allocation,Shift incremental budget toward high-ROAS and low-CPA channels while protecting upper-funnel investment.
Email & Retention,Scale basket recovery and loyalty campaigns because email typically shows high conversion efficiency.
Paid Search,Separate brand and non-brand performance; monitor non-brand CPA and shopping campaign ROAS.
Paid Social,Evaluate paid social using assisted conversions as well as last-click ROAS.
Display,Reduce broad prospecting display spend if CPA is high; prioritize retargeting and frequency controls.
Affiliate,Audit voucher and cashback partners for incrementality and margin impact.
Device Optimization,Improve mobile landing pages and checkout flow where conversion rate is lower than desktop.
Dashboard Monitoring,"Track spend, revenue, ROAS, CPA, conversion rate, and channel mix weekly."
